{
  "schema_version": "1.0.0",
  "generated_at": "2026-09-08T15:20:23Z",
  "paper": {
    "id": "paper:doi:10.7717/peerj-cs.1592",
    "title": "DAFuzz: data-aware fuzzing of in-memory data stores",
    "authors": [
      "Yingpei Zeng",
      "Fengmin Zhu",
      "Siyi Zhang",
      "Yu Yang",
      "Siyu Yi",
      "Yufan Pan",
      "Guojie Xie",
      "Ting Wu"
    ],
    "year": 2023,
    "venue": "PeerJ Computer Science",
    "doi": "10.7717/peerj-cs.1592",
    "arxiv_id": null,
    "s2_paper_id": "a3f904ba97221a2e65f6ac9e34f3403e287e0a49",
    "url": "https://doi.org/10.7717/peerj-cs.1592",
    "also_indexed_as": []
  },
  "sources": [
    {
      "kind": "fulltext",
      "route": "supplied_pdf",
      "url": "https://doi.org/10.7717/peerj-cs.1592",
      "retrieved_at": "2026-09-08T15:20:23Z",
      "chars": 68956,
      "content_sha256": "sha256:3c6a39098e20c89804ed4ae6443fe3b8bd2dd60be28dd1710900bd4b4569dfb9"
    }
  ],
  "document": {
    "has_fulltext": true,
    "page_count": 26,
    "has_outline": true,
    "sections": []
  },
  "references": [],
  "sqlancer_references": [],
  "mentions": [
    {
      "id": "M1",
      "found_by": "author_year_citation",
      "surface": "Rigger, 2023",
      "technique": null,
      "sentence": "1592 20/26 related program is SQL database, and different special black-box fuzzers ( Seltenreich, Tang & Mullender, 2022 ;Guo, 2017 ;Rigger, 2023 ;Rigger & Su, 2020 ) and grey-box fuzzers (Zhong et al.",
      "context_before": "ually could use data variables without de ﬁning them ﬁrst. However, different from the existing work, DAFuzz also generates data-aware and semantics-aware new inputs, which is to ensure that different data items are correctly referred to in the inputs. Data-related program fuzzing There are researchers focusing on fuzzing data-related programs. For in-memory data store, Google security researchers fuzzed Redis but only used existing ordinary fuzzers like AFL ( Google Information Security Engineering Team, 2020 ). Another kind of dataZeng et al. (2023), PeerJ Comput. Sci., DOI 10.7717/peerj-cs.",
      "context_after": ", 2020 ;Wang et al., 2021 ;Liang, Liu & Hu, 2022 ) have been developed. At ﬁrst, fuzzers mainly focus on keeping the generated or mutated SQL statements syntactically valid ( Seltenreich, Tang & Mullender, 2022 ;Guo, 2017 ). Recently, fuzzers also try to ensure the statements are semantically valid ( Rigger, 2023 ;Rigger & Su, 2020 ;Zhong et al., 2020; Wang et al., 2021 ;Liang, Liu & Hu, 2022 ). For example, they ensure that the used tables are created ﬁrst and the mentioned columns still exist ( Zhong et al., 2020 ;Liang, Liu & Hu, 2022). Several recent pieces of research focus on detecting l",
      "section": null,
      "page": 20,
      "char_offset": 52803,
      "found_by_all": [
        "author_year_citation"
      ],
      "techniques": []
    },
    {
      "id": "M2",
      "found_by": "author_year_citation",
      "surface": "Rigger, 2023",
      "technique": null,
      "sentence": "Recently, fuzzers also try to ensure the statements are semantically valid ( Rigger, 2023 ;Rigger & Su, 2020 ;Zhong et al.",
      "context_before": "d existing ordinary fuzzers like AFL ( Google Information Security Engineering Team, 2020 ). Another kind of dataZeng et al. (2023), PeerJ Comput. Sci., DOI 10.7717/peerj-cs.1592 20/26 related program is SQL database, and different special black-box fuzzers ( Seltenreich, Tang & Mullender, 2022 ;Guo, 2017 ;Rigger, 2023 ;Rigger & Su, 2020 ) and grey-box fuzzers (Zhong et al., 2020 ;Wang et al., 2021 ;Liang, Liu & Hu, 2022 ) have been developed. At ﬁrst, fuzzers mainly focus on keeping the generated or mutated SQL statements syntactically valid ( Seltenreich, Tang & Mullender, 2022 ;Guo, 2017 ).",
      "context_after": ", 2020; Wang et al., 2021 ;Liang, Liu & Hu, 2022 ). For example, they ensure that the used tables are created ﬁrst and the mentioned columns still exist ( Zhong et al., 2020 ;Liang, Liu & Hu, 2022). Several recent pieces of research focus on detecting logic bugs but not traditional crashes or assert failures ( Rigger, 2023 ;Rigger & Su, 2020 ;Liang, Liu & Hu, 2022 ). However, all these previous works do not intentionally create different kinds of data as DAFuzz does for providing the required data, and all these fuzzers are tightly bound to the SQL language and cannot work with in-memory data",
      "section": null,
      "page": 21,
      "char_offset": 53229,
      "found_by_all": [
        "author_year_citation"
      ],
      "techniques": []
    },
    {
      "id": "M3",
      "found_by": "author_year_citation",
      "surface": "Rigger, 2023",
      "technique": null,
      "sentence": "Several recent pieces of research focus on detecting logic bugs but not traditional crashes or assert failures ( Rigger, 2023 ;Rigger & Su, 2020 ;Liang, Liu & Hu, 2022 ).",
      "context_before": ";Rigger & Su, 2020 ) and grey-box fuzzers (Zhong et al., 2020 ;Wang et al., 2021 ;Liang, Liu & Hu, 2022 ) have been developed. At ﬁrst, fuzzers mainly focus on keeping the generated or mutated SQL statements syntactically valid ( Seltenreich, Tang & Mullender, 2022 ;Guo, 2017 ). Recently, fuzzers also try to ensure the statements are semantically valid ( Rigger, 2023 ;Rigger & Su, 2020 ;Zhong et al., 2020; Wang et al., 2021 ;Liang, Liu & Hu, 2022 ). For example, they ensure that the used tables are created ﬁrst and the mentioned columns still exist ( Zhong et al., 2020 ;Liang, Liu & Hu, 2022).",
      "context_after": "However, all these previous works do not intentionally create different kinds of data as DAFuzz does for providing the required data, and all these fuzzers are tightly bound to the SQL language and cannot work with in-memory data stores that use other languages. CONCLUSION To exercise the code paths of in-memory data stores that require different data, we presented a new fuzzing approach DAFuzz. DAFuzz could not only generate inputs that are syntactically and semantically valid but also use different data correctly. In addition, DAFuzz adopts the state-of-the-art tree-based mutation method as",
      "section": null,
      "page": 21,
      "char_offset": 53550,
      "found_by_all": [
        "author_year_citation"
      ],
      "techniques": []
    }
  ],
  "artifact": null,
  "checks": {
    "checks_version": "paper-checks-v1",
    "suggests": {},
    "suppressed": []
  },
  "analysis": {
    "analysis_version": "paper-analysis-v1",
    "prompt_version": "paper-analysis-v1",
    "produced_by": "claude_code_session",
    "model": "claude-opus-5",
    "generated_at": "2026-09-08T17:01:52Z",
    "is_model_written": true,
    "summary": "DAFuzz fuzzes in-memory data stores such as Redis, whose commands operate on typed data structures. Feeding a command arguments of the wrong type gets it rejected immediately, so DAFuzz tracks the types of live data and generates commands whose arguments match, reaching code that type-blind fuzzing does not.",
    "narrative": "SQLancer appears in the related-work survey in the ACM author-year style, so none of the three mentions names it directly -- they are reachable only through the citation. It is grouped with SQLsmith as a black-box fuzzer for SQL databases, cited again as an example of fuzzers that ensure statements are semantically valid, which is the property DAFuzz pursues for data-structure commands, and a third time as work targeting logic bugs rather than crashes or assertion failures.",
    "roles": {
      "M1": "background",
      "M2": "background",
      "M3": "background"
    },
    "relationships": {
      "uses_infrastructure": {
        "value": "no",
        "mention_ids": [],
        "quotes": [],
        "reasoning": "SQLancer is cited as related work; no reuse of its code, generator or workload is described."
      },
      "extends_technique": {
        "value": "no",
        "mention_ids": [],
        "quotes": [],
        "reasoning": "No SQLancer technique is extended; the citation is background."
      },
      "compares_with": {
        "value": "no",
        "mention_ids": [],
        "quotes": [],
        "reasoning": "No empirical comparison against SQLancer or one of its oracles is reported."
      },
      "describes_as_state_of_the_art": {
        "value": "no",
        "mention_ids": [],
        "quotes": [],
        "reasoning": "The text does not describe SQLancer as the state of the art."
      }
    },
    "disagreements": [],
    "unresolved": []
  },
  "provenance": {
    "extractor_version": "paper-extract-v1",
    "inventory_version": "paper-mentions-v1",
    "checks_version": "paper-checks-v1",
    "policy_version": "impact-policy-v1"
  }
}
