{
  "schema_version": "1.0.0",
  "generated_at": "2026-09-10T15:09:34Z",
  "paper": {
    "id": "paper:doi:10.1145/3729175",
    "title": "Systems Correctness Practices at Amazon Web Services",
    "authors": [
      "Marc Brooker",
      "A. Desai"
    ],
    "year": 2025,
    "venue": "Communications of the ACM",
    "doi": "10.1145/3729175",
    "arxiv_id": null,
    "s2_paper_id": "f9fb97518fae800c5bd88b573e3211307cd61b5d",
    "url": "https://doi.org/10.1145/3729175",
    "also_indexed_as": [
      "paper:doi:10.1145/3712057"
    ]
  },
  "sources": [
    {
      "kind": "fulltext",
      "route": "supplied_pdf",
      "url": "https://doi.org/10.1145/3729175",
      "retrieved_at": "2026-09-10T15:09:34Z",
      "chars": 25458,
      "content_sha256": "sha256:2e021fb5b3190121fc6b8405e871b09dfea313616429eeba8ed2902ebbfd3053"
    }
  ],
  "document": {
    "has_fulltext": true,
    "page_count": 5,
    "has_outline": false,
    "sections": [
      {
        "number": "1",
        "title": "Amazon S3 now delivers strong read-after-write",
        "start": 22313
      },
      {
        "number": "2",
        "title": "Announcing general availability of AWS Fault Injection",
        "start": 22469
      },
      {
        "number": "3",
        "title": "Announcing Amazon Aurora Limitless Database.",
        "start": 22651
      },
      {
        "number": "4",
        "title": "Bornholt, J. et al. Using lightweight formal methods",
        "start": 22757
      },
      {
        "number": "5",
        "title": "Bronson, N., Aghayev, A., Charapko, A., and Zhu,",
        "start": 22983
      }
    ]
  },
  "references": [
    {
      "number": 1,
      "text": "Amazon S3 now delivers strong read-after-write consistency automatically for all applications. Amazon Web Services (2020); https://tinyurl.com/25mwxugm.",
      "is_sqlancer_publication": false
    },
    {
      "number": 2,
      "text": "Announcing general availability of AWS Fault Injection Simulator, a fully managed service to run controlled experiments. Amazon Web Services (2021); https://tinyurl.com/yhnr9nuj.",
      "is_sqlancer_publication": false
    },
    {
      "number": 3,
      "text": "Announcing Amazon Aurora Limitless Database. Amazon Web Services (2023); https://tinyurl.com/28hwdrm8.",
      "is_sqlancer_publication": false
    },
    {
      "number": 4,
      "text": "Bornholt, J. et al. Using lightweight formal methods to validate a key-value storage node in Amazon S3. In Proceedings of the ACMSIGOPS 28th Symp. Operating Systems Principles (2021), 836–850; https://tinyurl.com/2yczbl4s.",
      "is_sqlancer_publication": false
    },
    {
      "number": 5,
      "text": "Bronson, N., Aghayev, A., Charapko, A., and Zhu, T. Metastable failures in distributed systems. In Challenges and Opportunities for the Future Despite significant success in scaling formal and semi-formal testing meth ods across AWS over the past 15 years, several challenges persist, particularly in industrial adoption of formal meth ods. The primary barriers for formal methods tools include their",
      "is_sqlancer_publication": false
    }
  ],
  "sqlancer_references": [],
  "mentions": [
    {
      "id": "M1",
      "found_by": "technique",
      "surface": "pivoted query synthesis",
      "technique": "pqs",
      "sentence": "Testing database engines via pivoted query synthesis.",
      "context_before": "cIver, D.R. et al. Hypothesis: A new approach to property-based testing. J. Open Source Software 4, 43 (2019), 1,891; https://tinyurl.com/239azs4n. 20. Monteiro, F. and Roy, P. Using Kani to validate security boundaries in AWS Firecracker. Technical report, Amazon Web Services (2023); https://tinyurl.com/2cf6dub8. 21. Newcombe, C. et al. How Amazon Web Services uses formal methods. Commun. ACM 58, 4 (2015), 66–73; https://tinyurl.com/2au9fctm. 22. P Team. P: A programming language for formal specification of distributed systems (2024); https://github.com/p-org/P 23. Rigger, M. and Su, Z. 2020.",
      "context_after": "In Proceedings of the 14th Usenix Symp. on Operating Systems Design and Implementation, Article 38 (2020), 667–682; https://tinyurl.com/2da6rn2e. 24. Rungta, N. Trillions of formally verified authorizations a day! Splash keynote (2024); https://tinyurl.com/24ufvhff. 25. Vogels, W. Diving deep on S3 consistency. All Things Distributed; https://tinyurl.com/2xo4xelw. Marc Brooker is a distinguished engineer at Amazon Web Services, Seattle, WA, USA. Ankush Desai is a principal applied scientist at Amazon Web Services, Seattle, WA, USA.challenges of formal methods in prac tice. Just as AI-assisted",
      "section": null,
      "page": 5,
      "char_offset": 20679,
      "found_by_all": [
        "technique"
      ],
      "techniques": [
        "pqs"
      ]
    }
  ],
  "artifact": null,
  "checks": {
    "checks_version": "paper-checks-v1",
    "suggests": {},
    "suppressed": []
  },
  "analysis": {
    "analysis_version": "paper-analysis-v1",
    "prompt_version": "paper-analysis-v1",
    "produced_by": "claude_code_session",
    "model": "claude-opus-5",
    "generated_at": "2026-09-08T02:17:50Z",
    "is_model_written": true,
    "summary": "An account of how Amazon Web Services applies formal and semi-formal methods to systems correctness, covering lightweight formal methods, deterministic simulation testing, and property-based approaches used across its services.",
    "narrative": "The extracted page carries a bibliography entry for pivoted query synthesis. The passage crediting SQLancer with pioneering validation approaches used alongside AWS's own non-sharded reference oracle is in the article but did not survive extraction of this five-page excerpt, which begins mid-sentence and carries no title.",
    "roles": {
      "M1": "background"
    },
    "relationships": {
      "uses_infrastructure": {
        "value": "uncertain",
        "mention_ids": [],
        "quotes": [],
        "reasoning": "The citation index recorded a sentence describing AWS as validating against an oracle 'as well as other approaches to validation, like those pioneered by SQLancer', which suggests use in production, but that sentence is not among the mentions extracted from this PDF."
      },
      "extends_technique": {
        "value": "no",
        "mention_ids": [],
        "quotes": [],
        "reasoning": "No technique is extended; the citation is background."
      },
      "compares_with": {
        "value": "no",
        "mention_ids": [],
        "quotes": [],
        "reasoning": "No empirical comparison against SQLancer is reported in the mentions."
      },
      "describes_as_state_of_the_art": {
        "value": "no",
        "mention_ids": [],
        "quotes": [],
        "reasoning": "The citation does not characterise SQLancer as the state of the art."
      }
    },
    "disagreements": [],
    "unresolved": []
  },
  "provenance": {
    "extractor_version": "paper-extract-v1",
    "inventory_version": "paper-mentions-v1",
    "checks_version": "paper-checks-v1",
    "policy_version": "impact-policy-v1"
  }
}
