{
  "schema_version": "1.0.0",
  "generated_at": "2026-09-07T17:01:52Z",
  "paper": {
    "id": "paper:doi:10.1109/compsac57700.2023.00273",
    "title": "Detecting Hidden Failures of DBMS: A Comprehensive Metamorphic Relation Output Patterns Approach",
    "authors": [
      "M. Tang",
      "T. Tse",
      "Z. Zhou"
    ],
    "year": 2023,
    "venue": "Annual International Computer Software and Applications Conference",
    "doi": "10.1109/compsac57700.2023.00273",
    "arxiv_id": null,
    "s2_paper_id": "e9db272057833ba69d1c6e9ecbb992af02ce25a9",
    "url": "https://doi.org/10.1109/compsac57700.2023.00273",
    "also_indexed_as": []
  },
  "sources": [
    {
      "kind": "fulltext",
      "route": "supplied_pdf",
      "url": "https://doi.org/10.1109/compsac57700.2023.00273",
      "retrieved_at": "2026-09-07T17:01:52Z",
      "chars": 124887,
      "content_sha256": "sha256:1a401396766ddbfd931069fd7214266d8f7892ce2b03e9afeff5e95a2c5df128"
    }
  ],
  "document": {
    "has_fulltext": true,
    "page_count": 6,
    "has_outline": false,
    "sections": []
  },
  "references": [],
  "sqlancer_references": [],
  "mentions": [],
  "artifact": null,
  "checks": {
    "checks_version": "paper-checks-v1",
    "suggests": {},
    "suppressed": []
  },
  "analysis": {
    "analysis_version": "paper-analysis-v1",
    "prompt_version": "paper-analysis-v1",
    "produced_by": "claude_code_session",
    "model": "claude-opus-5",
    "generated_at": "2026-09-08T17:23:30Z",
    "is_model_written": true,
    "summary": "This work detects hidden failures in DBMSs using a comprehensive set of metamorphic relations over output patterns -- relations between the outputs of related queries that must hold, so a violation exposes a fault that produces plausible-looking but wrong results.",
    "narrative": "No SQLancer mention could be extracted. Neither the tool nor any of its technique names appears anywhere in the document text, and no bibliography parsed. Given the subject -- metamorphic relations for finding logic bugs in DBMSs -- a relationship is likely, so the absence should be read as an extraction limit rather than as evidence of none.",
    "roles": {},
    "relationships": {
      "uses_infrastructure": {
        "value": "insufficient_evidence",
        "mention_ids": [],
        "quotes": [],
        "reasoning": "The extracted text contains no sentence naming SQLancer or one of its techniques, and no bibliography entry resolved to a SQLancer publication. With no mention to reason from, no relationship can be judged either way."
      },
      "extends_technique": {
        "value": "insufficient_evidence",
        "mention_ids": [],
        "quotes": [],
        "reasoning": "The extracted text contains no sentence naming SQLancer or one of its techniques, and no bibliography entry resolved to a SQLancer publication. With no mention to reason from, no relationship can be judged either way."
      },
      "compares_with": {
        "value": "insufficient_evidence",
        "mention_ids": [],
        "quotes": [],
        "reasoning": "The extracted text contains no sentence naming SQLancer or one of its techniques, and no bibliography entry resolved to a SQLancer publication. With no mention to reason from, no relationship can be judged either way."
      },
      "describes_as_state_of_the_art": {
        "value": "insufficient_evidence",
        "mention_ids": [],
        "quotes": [],
        "reasoning": "The extracted text contains no sentence naming SQLancer or one of its techniques, and no bibliography entry resolved to a SQLancer publication. With no mention to reason from, no relationship can be judged either way."
      }
    },
    "disagreements": [],
    "unresolved": [
      "The document text contains no occurrence of SQLancer or any technique name, and no bibliography parsed. For a paper on metamorphic DBMS testing that is more likely an extraction failure than a real absence; the PDF's text layer should be re-examined."
    ]
  },
  "provenance": {
    "extractor_version": "paper-extract-v1",
    "inventory_version": "paper-mentions-v1",
    "checks_version": "paper-checks-v1",
    "policy_version": "impact-policy-v1"
  }
}
